[
	{
		"name": "pypi lowercase",
		"input": { "value": "pypi" },
		"expected": { "ecosystem": "pypi" },
		"error": null
	},
	{
		"name": "pypi uppercase",
		"input": { "value": "PYPI" },
		"expected": { "ecosystem": "pypi" },
		"error": null
	},
	{
		"name": "pypi mixed case",
		"input": { "value": "PyPI" },
		"expected": { "ecosystem": "pypi" },
		"error": null
	},
	{
		"name": "npm lowercase",
		"input": { "value": "npm" },
		"expected": { "ecosystem": "npm" },
		"error": null
	},
	{
		"name": "npm uppercase",
		"input": { "value": "NPM" },
		"expected": { "ecosystem": "npm" },
		"error": null
	},
	{
		"name": "cargo lowercase",
		"input": { "value": "cargo" },
		"expected": { "ecosystem": "cargo" },
		"error": null
	},
	{
		"name": "crates alias",
		"input": { "value": "crates" },
		"expected": { "ecosystem": "cargo" },
		"error": null
	},
	{
		"name": "crates uppercase alias",
		"input": { "value": "CRATES" },
		"expected": { "ecosystem": "cargo" },
		"error": null
	},
	{
		"name": "hex lowercase",
		"input": { "value": "hex" },
		"expected": { "ecosystem": "hex" },
		"error": null
	},
	{
		"name": "hex uppercase",
		"input": { "value": "HEX" },
		"expected": { "ecosystem": "hex" },
		"error": null
	},
	{
		"name": "unknown ecosystem",
		"input": { "value": "maven" },
		"expected": {},
		"error": "unknown ecosystem"
	},
	{
		"name": "empty string",
		"input": { "value": "" },
		"expected": {},
		"error": "unknown ecosystem"
	},
	{
		"name": "numeric input",
		"input": { "value": "123" },
		"expected": {},
		"error": "unknown ecosystem"
	}
]
