[
	{
		"name": "minimal lock file",
		"input": {
			"toml": "[metadata]\nschema_version = 1\ngenerated_at = \"2026-04-19T10:30:00Z\"\ndepot_version = \"0.1.0\"\n"
		},
		"expected": {
			"schema_version": 1,
			"depot_version": "0.1.0",
			"package_count": 0
		},
		"error": null
	},
	{
		"name": "lock file with one package",
		"input": {
			"toml": "[metadata]\nschema_version = 1\ngenerated_at = \"2026-04-19T10:30:00Z\"\ndepot_version = \"0.1.0\"\n\n[[packages]]\necosystem = \"pypi\"\nname = \"requests\"\nversion = \"2.31.0\"\nresolved_from = \"https://pypi.org\"\npinned = true\n\n[[packages.artifacts]]\nfilename = \"requests-2.31.0.tar.gz\"\nblake3 = \"abcdef1234567890\"\nsize = 110293\n"
		},
		"expected": {
			"schema_version": 1,
			"depot_version": "0.1.0",
			"package_count": 1,
			"first_package_name": "requests",
			"first_package_ecosystem": "pypi"
		},
		"error": null
	},
	{
		"name": "lock file with multiple ecosystems",
		"input": {
			"toml": "[metadata]\nschema_version = 1\ngenerated_at = \"2026-04-19T10:30:00Z\"\ndepot_version = \"0.1.0\"\n\n[[packages]]\necosystem = \"pypi\"\nname = \"requests\"\nversion = \"2.31.0\"\nresolved_from = \"https://pypi.org\"\n\n[[packages.artifacts]]\nfilename = \"requests-2.31.0.tar.gz\"\nblake3 = \"aaa\"\nsize = 100\n\n[[packages]]\necosystem = \"npm\"\nname = \"lodash\"\nversion = \"4.17.21\"\nresolved_from = \"https://registry.npmjs.org\"\n\n[[packages.artifacts]]\nfilename = \"lodash-4.17.21.tgz\"\nblake3 = \"bbb\"\nsize = 200\n"
		},
		"expected": {
			"schema_version": 1,
			"package_count": 2
		},
		"error": null
	}
]
